{
  "$schema": "https://json-schema.org/draft/2020-12/schema",
  "$id": "https://example.test/acah/capability-contract.schema.json",
  "title": "Agent Capability Contract",
  "type": "object",
  "additionalProperties": false,
  "required": ["schema_version", "contract_id", "policy_version", "default_verdict", "capabilities"],
  "properties": {
    "schema_version": {"const": "1.0"},
    "contract_id": {"type": "string", "pattern": "^[a-z0-9][a-z0-9._-]{1,127}$"},
    "policy_version": {"type": "string", "minLength": 1},
    "default_verdict": {"const": "deny"},
    "capabilities": {
      "type": "array",
      "minItems": 1,
      "items": {
        "type": "object",
        "additionalProperties": false,
        "required": ["id", "description", "effect", "verdict", "constraints"],
        "properties": {
          "id": {"type": "string", "pattern": "^[a-z0-9][a-z0-9._-]{1,127}$"},
          "description": {"type": "string", "minLength": 1},
          "effect": {"enum": ["read", "write", "network", "process", "secret", "external_side_effect", "analysis"]},
          "verdict": {"enum": ["allow", "ask", "deny"]},
          "constraints": {
            "type": "object",
            "additionalProperties": false,
            "properties": {
              "paths": {"type": "array", "items": {"type": "string"}},
              "hosts": {"type": "array", "items": {"type": "string"}},
              "methods": {"type": "array", "items": {"type": "string"}},
              "databases": {"type": "array", "items": {"type": "string"}},
              "operations": {"type": "array", "items": {"type": "string"}},
              "max_rows": {"type": "integer", "minimum": 0},
              "max_bytes": {"type": "integer", "minimum": 0},
              "reversible_only": {"type": "boolean"}
            }
          }
        }
      }
    }
  }
}
