{
  "capabilities": [
    {
      "constraints": {
        "paths": [
          "repo/**"
        ]
      },
      "description": "Read declared files inside a synthetic repository scope.",
      "effect": "read",
      "id": "repo.read",
      "verdict": "allow"
    },
    {
      "constraints": {
        "paths": [
          "repo/**"
        ],
        "reversible_only": true
      },
      "description": "Write reversible changes inside the declared repository scope after approval.",
      "effect": "write",
      "id": "repo.write",
      "verdict": "ask"
    },
    {
      "constraints": {
        "hosts": [
          "docs.example.test"
        ],
        "max_bytes": 50000,
        "methods": [
          "GET"
        ]
      },
      "description": "Read allowlisted synthetic documentation over GET only.",
      "effect": "network",
      "id": "browser.read_allowlisted",
      "verdict": "allow"
    },
    {
      "constraints": {},
      "description": "Submit forms or mutate a browser session.",
      "effect": "external_side_effect",
      "id": "browser.submit",
      "verdict": "deny"
    },
    {
      "constraints": {
        "databases": [
          "test-analytics"
        ],
        "max_rows": 1000,
        "operations": [
          "select"
        ]
      },
      "description": "Run bounded SELECT operations against the synthetic test database.",
      "effect": "read",
      "id": "sql.select_test_db",
      "verdict": "allow"
    },
    {
      "constraints": {},
      "description": "Mutate database state.",
      "effect": "write",
      "id": "sql.write",
      "verdict": "deny"
    },
    {
      "constraints": {},
      "description": "Execute arbitrary shell commands.",
      "effect": "process",
      "id": "shell.exec",
      "verdict": "deny"
    },
    {
      "constraints": {},
      "description": "Read credentials or secret values.",
      "effect": "secret",
      "id": "secret.read",
      "verdict": "deny"
    },
    {
      "constraints": {},
      "description": "Access arbitrary external network destinations.",
      "effect": "network",
      "id": "network.unrestricted",
      "verdict": "deny"
    },
    {
      "constraints": {
        "max_bytes": 100000,
        "paths": [
          "workspace/**"
        ]
      },
      "description": "Read declared files from the synthetic workspace.",
      "effect": "read",
      "id": "files.read",
      "verdict": "allow"
    },
    {
      "constraints": {
        "paths": [
          "workspace/**"
        ],
        "reversible_only": true
      },
      "description": "Rename a declared file when the operation is reversible and approved.",
      "effect": "write",
      "id": "files.rename",
      "verdict": "ask"
    },
    {
      "constraints": {},
      "description": "Delete files.",
      "effect": "write",
      "id": "files.delete",
      "verdict": "deny"
    },
    {
      "constraints": {
        "max_bytes": 10000
      },
      "description": "Create a bounded local draft without sending it.",
      "effect": "analysis",
      "id": "docs.draft",
      "verdict": "allow"
    },
    {
      "constraints": {},
      "description": "Send an outbound email or message.",
      "effect": "external_side_effect",
      "id": "email.send",
      "verdict": "deny"
    },
    {
      "constraints": {},
      "description": "Accept price, contract, payment, or other external commitment.",
      "effect": "external_side_effect",
      "id": "external.commitment",
      "verdict": "deny"
    },
    {
      "constraints": {
        "max_bytes": 100000,
        "paths": [
          "artifacts/**"
        ]
      },
      "description": "Write bounded evidence artifacts into the run artifact directory.",
      "effect": "write",
      "id": "artifact.write",
      "verdict": "allow"
    }
  ],
  "contract_id": "public-synthetic-capability-contract",
  "default_verdict": "deny",
  "policy_version": "2026-08-30.v1",
  "schema_version": "1.0"
}
